{
  "intent_drift_review_id": "intent-drift-review-2026-06-25-external",
  "project_id": "relay",
  "plan_attempt_id": "attempt-drift-external",
  "intent_thread_id": "thread-drift-external",
  "root_intent_packet_id": "intent-drift-external",
  "reviewed_intent_packet_id": "intent-drift-external",
  "review_packet_hash": "sha256:0123456789abcdef0123456789abcdef0123456789abcdef0123456789abcdef",
  "provenance": {
    "review_source": "external",
    "submitted_by": "api-test"
  },
  "overall_alignment": "aligned",
  "confidence": 0.90,
  "findings": [],
  "recommended_action": "approve",
  "approval_gate_status": "ready",
  "model_metadata": {
    "provider": "fake",
    "model": "fake-standard",
    "model_tier": "standard",
    "temperature": 0.0
  },
  "input_hash": "sha256:0123456789abcdef0123456789abcdef0123456789abcdef0123456789abcdef",
  "output_hash": "sha256:0123456789abcdef0123456789abcdef0123456789abcdef0123456789abcdef",
  "created_at": "2026-06-25T23:15:53Z"
}
