{
  "intent_drift_review_id": "intent-drift-review-2026-06-25-major",
  "project_id": "relay",
  "plan_attempt_id": "attempt-drift-major",
  "intent_thread_id": "thread-drift-major",
  "root_intent_packet_id": "intent-drift-major",
  "reviewed_intent_packet_id": "intent-drift-major",
  "review_packet_hash": "sha256:0123456789abcdef0123456789abcdef0123456789abcdef0123456789abcdef",
  "provenance": {
    "review_source": "internal",
    "submitted_by": "relay-internal-drift-reviewer"
  },
  "overall_alignment": "major_drift",
  "confidence": 0.95,
  "findings": [
    {
      "finding_id": "finding-high-1",
      "severity": "high",
      "summary": "Major out-of-scope files modified",
      "evidence": [
        "Modified internal/api/runs/handler.go which is out of scope"
      ],
      "suggested_resolution": "Revise the plan to include api changes or remove changes"
    }
  ],
  "recommended_action": "revise",
  "approval_gate_status": "revision_required",
  "model_metadata": {
    "provider": "fake",
    "model": "fake-standard",
    "model_tier": "standard",
    "temperature": 0.0
  },
  "input_hash": "sha256:0123456789abcdef0123456789abcdef0123456789abcdef0123456789abcdef",
  "output_hash": "sha256:0123456789abcdef0123456789abcdef0123456789abcdef0123456789abcdef",
  "created_at": "2026-06-25T23:15:53Z"
}
