{
  "intent_drift_review_id": "intent-drift-review-2026-06-25-minor",
  "project_id": "relay",
  "plan_attempt_id": "attempt-drift-minor",
  "intent_thread_id": "thread-drift-minor",
  "root_intent_packet_id": "intent-drift-minor",
  "reviewed_intent_packet_id": "intent-drift-minor",
  "review_packet_hash": "sha256:0123456789abcdef0123456789abcdef0123456789abcdef0123456789abcdef",
  "provenance": {
    "review_source": "internal",
    "submitted_by": "relay-internal-drift-reviewer"
  },
  "overall_alignment": "minor_drift",
  "confidence": 0.92,
  "findings": [
    {
      "finding_id": "finding-medium-1",
      "severity": "medium",
      "summary": "Minor changes to plan sequence",
      "evidence": [
        "Sequence changed from 1 to 2 in pass PASS-001"
      ],
      "suggested_resolution": "Acknowledge the change before executing"
    }
  ],
  "recommended_action": "approve_with_acknowledgement",
  "approval_gate_status": "acknowledgement_required",
  "model_metadata": {
    "provider": "fake",
    "model": "fake-standard",
    "model_tier": "standard",
    "temperature": 0.0
  },
  "input_hash": "sha256:0123456789abcdef0123456789abcdef0123456789abcdef0123456789abcdef",
  "output_hash": "sha256:0123456789abcdef0123456789abcdef0123456789abcdef0123456789abcdef",
  "created_at": "2026-06-25T23:15:53Z"
}
